{
  "id": "base:harbour_roasters",
  "type": "supplier",
  "name": "loc:supplier.harbour_roasters",
  "catalogue": [
    "hot_beverages"
  ],
  "lead_time_days": [
    1,
    3
  ],
  "minimum_order": 120.0,
  "price_tier": "premium",
  "reliability": 0.98,
  "legitimacy": {
    "counterfeit_rate": 0.0,
    "manifest_accuracy": 0.99,
    "credentials_verifiable": true
  }
}
